<!DOCTYPE batiment SYSTEM "dtd1-2.dtd">
<batiment>
  <etage>
     <description>
       descriptionEtage1
     </description>
     <salle>
       <nombrePlaces>
 	 25
       </nombrePlaces>
     </salle>
     <salle>
       <nombrePlaces>
 	50
       </nombrePlaces>
     </salle>
   </etage>
   <etage>
     <description>
       descriptionEtage2
     </description>
     <bureau>
       <code>
 	B02
       </code>
       <personne>
 	Personne1
       </personne>
     </bureau>
     <bureau>
       <code>
 	 B03
       </code>
       <personne>
 	Personne2
       </personne>
       <personne>
 	Personne3
       </personne>
     </bureau>
   </etage>
</batiment>
